--
-- edge cases: identifiers, data types, ordering, generated columns,
-- schemas, undo-of-undo, and recycle-bin corners
--
--
-- quoted identifiers and awkward column names round-trip
--
CREATE TABLE "Weird Table" (
	"Id" int PRIMARY KEY,
	"select" text,
	"col with space" text,
	"col""quote" text
);
SELECT undo.track('"Weird Table"');
NOTICE:  pg_undo: tracking "Weird Table"; history capture begins within pg_undo.naptime
 track 
-------
 
(1 row)

INSERT INTO "Weird Table" VALUES (1, 'a', 'b', 'c');
UPDATE "Weird Table" SET "select" = 'x' WHERE "Id" = 1;
DELETE FROM "Weird Table";
SELECT wait_for_history('"Weird Table"', 3);
 wait_for_history 
------------------
 t
(1 row)

SELECT xid AS wt_del_xid FROM undo.history
 WHERE relid = '"Weird Table"'::regclass::oid AND op = 'D' \gset
SELECT * FROM undo.apply(xid => :wt_del_xid);
 applied | skipped | conflicts 
---------+---------+-----------
       1 |       0 |         0
(1 row)

SELECT * FROM "Weird Table";
 Id | select | col with space | col"quote 
----+--------+----------------+-----------
  1 | x      | b              | c
(1 row)

--
-- data types and NULL vs the string 'null'
--
CREATE TABLE typ (id int PRIMARY KEY, t text, b bytea, n numeric(10,4),
				  ts timestamptz, ia int[], j jsonb, f boolean);
SELECT undo.track('typ');
NOTICE:  pg_undo: tracking typ; history capture begins within pg_undo.naptime
 track 
-------
 
(1 row)

INSERT INTO typ VALUES
	(1, E'line1\nline2 ''q'' "dq" \\bs', '\xdeadbeef', 1234.5678,
	 '2026-01-02 03:04:05+00', '{1,2,3}', '{"k": [1, null, "v"]}', true);
INSERT INTO typ (id) VALUES (2);			-- all NULLs
INSERT INTO typ (id, t) VALUES (3, 'null');	-- the string, not NULL
DELETE FROM typ;
SELECT wait_for_history('typ', 6);
 wait_for_history 
------------------
 t
(1 row)

SELECT xid AS typ_del_xid FROM undo.history
 WHERE relid = 'typ'::regclass::oid AND op = 'D' LIMIT 1 \gset
SELECT * FROM undo.apply(xid => :typ_del_xid);
 applied | skipped | conflicts 
---------+---------+-----------
       3 |       0 |         0
(1 row)

SELECT id, t, encode(b, 'hex') AS b, n, ts, ia, j, f FROM typ ORDER BY id;
 id |         t          |    b     |     n     |              ts              |   ia    |           j           | f 
----+--------------------+----------+-----------+------------------------------+---------+-----------------------+---
  1 | line1             +| deadbeef | 1234.5678 | Thu Jan 01 19:04:05 2026 PST | {1,2,3} | {"k": [1, null, "v"]} | t
    | line2 'q' "dq" \bs |          |           |                              |         |                       | 
  2 |                    |          |           |                              |         |                       | 
  3 | null               |          |           |                              |         |                       | 
(3 rows)

SELECT id, t IS NULL AS t_is_null, t = 'null' AS t_is_the_string
  FROM typ ORDER BY id;
 id | t_is_null | t_is_the_string 
----+-----------+-----------------
  1 | f         | f
  2 | t         | 
  3 | f         | t
(3 rows)

--
-- several changes to the same row unwind newest-first
--
CREATE TABLE mc (id int PRIMARY KEY, v int);
SELECT undo.track('mc');
NOTICE:  pg_undo: tracking mc; history capture begins within pg_undo.naptime
 track 
-------
 
(1 row)

INSERT INTO mc VALUES (1, 10);
SELECT wait_for_history('mc', 1);
 wait_for_history 
------------------
 t
(1 row)

SELECT now() AS mc_t0 \gset
UPDATE mc SET v = 20 WHERE id = 1;
UPDATE mc SET v = 30 WHERE id = 1;
DELETE FROM mc;
SELECT wait_for_history('mc', 4);
 wait_for_history 
------------------
 t
(1 row)

SELECT * FROM undo.apply(since => :'mc_t0', "table" => 'mc');
 applied | skipped | conflicts 
---------+---------+-----------
       3 |       0 |         0
(1 row)

SELECT * FROM mc;
 id | v  
----+----
  1 | 10
(1 row)

--
-- undo of the undo
--
SELECT wait_for_history('mc', 7);	-- the apply itself was captured
 wait_for_history 
------------------
 t
(1 row)

SELECT max(xid) AS mc_undo_xid FROM undo.history
 WHERE relid = 'mc'::regclass::oid \gset
SELECT * FROM undo.apply(xid => :mc_undo_xid);
 applied | skipped | conflicts 
---------+---------+-----------
       3 |       0 |         0
(1 row)

SELECT count(*) AS back_to_deleted FROM mc;
 back_to_deleted 
-----------------
               0
(1 row)

--
-- INSERT + UPDATE + DELETE of one row in a single transaction nets to zero
--
CREATE TABLE onetxn (id int PRIMARY KEY, v text);
SELECT undo.track('onetxn');
NOTICE:  pg_undo: tracking onetxn; history capture begins within pg_undo.naptime
 track 
-------
 
(1 row)

BEGIN;
INSERT INTO onetxn VALUES (1, 'a');
UPDATE onetxn SET v = 'b' WHERE id = 1;
DELETE FROM onetxn;
COMMIT;
SELECT wait_for_history('onetxn', 3);
 wait_for_history 
------------------
 t
(1 row)

SELECT xid AS ot_xid FROM undo.history
 WHERE relid = 'onetxn'::regclass::oid LIMIT 1 \gset
SELECT * FROM undo.apply(xid => :ot_xid);
 applied | skipped | conflicts 
---------+---------+-----------
       3 |       0 |         0
(1 row)

SELECT count(*) FROM onetxn;
 count 
-------
     0
(1 row)

--
-- undoing a primary-key UPDATE restores the old key
--
CREATE TABLE pkup (id int PRIMARY KEY, v text);
SELECT undo.track('pkup');
NOTICE:  pg_undo: tracking pkup; history capture begins within pg_undo.naptime
 track 
-------
 
(1 row)

INSERT INTO pkup VALUES (1, 'x');
SELECT wait_for_history('pkup', 1);
 wait_for_history 
------------------
 t
(1 row)

SELECT now() AS pk_t0 \gset
UPDATE pkup SET id = 2 WHERE id = 1;
SELECT wait_for_history('pkup', 2);
 wait_for_history 
------------------
 t
(1 row)

SELECT * FROM undo.apply(since => :'pk_t0', "table" => 'pkup');
 applied | skipped | conflicts 
---------+---------+-----------
       1 |       0 |         0
(1 row)

SELECT * FROM pkup;
 id | v 
----+---
  1 | x
(1 row)

--
-- generated columns are recomputed, identity columns restored verbatim
--
CREATE TABLE gen (id int PRIMARY KEY, a int,
				  dbl int GENERATED ALWAYS AS (a * 2) STORED);
SELECT undo.track('gen');
NOTICE:  pg_undo: tracking gen; history capture begins within pg_undo.naptime
 track 
-------
 
(1 row)

INSERT INTO gen VALUES (1, 21);
DELETE FROM gen;
SELECT wait_for_history('gen', 2);
 wait_for_history 
------------------
 t
(1 row)

SELECT xid AS gen_del_xid FROM undo.history
 WHERE relid = 'gen'::regclass::oid AND op = 'D' \gset
SELECT * FROM undo.apply(xid => :gen_del_xid);
 applied | skipped | conflicts 
---------+---------+-----------
       1 |       0 |         0
(1 row)

SELECT * FROM gen;
 id | a  | dbl 
----+----+-----
  1 | 21 |  42
(1 row)

CREATE TABLE idt (id int GENERATED ALWAYS AS IDENTITY PRIMARY KEY, v text);
SELECT undo.track('idt');
NOTICE:  pg_undo: tracking idt; history capture begins within pg_undo.naptime
 track 
-------
 
(1 row)

INSERT INTO idt (v) VALUES ('a'), ('b');
DELETE FROM idt;
SELECT wait_for_history('idt', 4);
 wait_for_history 
------------------
 t
(1 row)

SELECT xid AS idt_del_xid FROM undo.history
 WHERE relid = 'idt'::regclass::oid AND op = 'D' LIMIT 1 \gset
SELECT * FROM undo.apply(xid => :idt_del_xid);	-- OVERRIDING SYSTEM VALUE path
 applied | skipped | conflicts 
---------+---------+-----------
       2 |       0 |         0
(1 row)

SELECT * FROM idt ORDER BY id;
 id | v 
----+---
  1 | a
  2 | b
(2 rows)

--
-- tables without a primary key match on the full row image
--
CREATE TABLE norow (a int, v text);
SELECT undo.track('norow');
WARNING:  pg_undo: norow has no primary key; undo will match rows on the full row image
NOTICE:  pg_undo: tracking norow; history capture begins within pg_undo.naptime
 track 
-------
 
(1 row)

INSERT INTO norow VALUES (1, 'x'), (2, 'y');
SELECT wait_for_history('norow', 2);
 wait_for_history 
------------------
 t
(1 row)

SELECT now() AS nr_t0 \gset
UPDATE norow SET v = 'z' WHERE a = 1;
DELETE FROM norow WHERE a = 2;
SELECT wait_for_history('norow', 4);
 wait_for_history 
------------------
 t
(1 row)

SELECT * FROM undo.apply(since => :'nr_t0', "table" => 'norow');
 applied | skipped | conflicts 
---------+---------+-----------
       2 |       0 |         0
(1 row)

SELECT * FROM norow ORDER BY a;
 a | v 
---+---
 1 | x
 2 | y
(2 rows)

--
-- tables outside public
--
CREATE SCHEMA app;
CREATE TABLE app.orders (id int PRIMARY KEY, v text);
SELECT undo.track('app.orders');
NOTICE:  pg_undo: tracking app.orders; history capture begins within pg_undo.naptime
 track 
-------
 
(1 row)

INSERT INTO app.orders VALUES (1, 'o');
DELETE FROM app.orders;
SELECT wait_for_history('app.orders', 2);
 wait_for_history 
------------------
 t
(1 row)

SELECT xid AS ord_del_xid FROM undo.history
 WHERE relid = 'app.orders'::regclass::oid AND op = 'D' \gset
SELECT * FROM undo.apply(xid => :ord_del_xid);
 applied | skipped | conflicts 
---------+---------+-----------
       1 |       0 |         0
(1 row)

SELECT * FROM app.orders;
 id | v 
----+---
  1 | o
(1 row)

--
-- one apply can span several tables; an empty window applies nothing
--
CREATE TABLE w1 (id int PRIMARY KEY);
CREATE TABLE w2 (id int PRIMARY KEY);
SELECT undo.track('w1');
NOTICE:  pg_undo: tracking w1; history capture begins within pg_undo.naptime
 track 
-------
 
(1 row)

SELECT undo.track('w2');
NOTICE:  pg_undo: tracking w2; history capture begins within pg_undo.naptime
 track 
-------
 
(1 row)

INSERT INTO w1 VALUES (1);
INSERT INTO w2 VALUES (1);
SELECT wait_for_history('w1', 1);
 wait_for_history 
------------------
 t
(1 row)

SELECT wait_for_history('w2', 1);
 wait_for_history 
------------------
 t
(1 row)

SELECT now() AS w_t0 \gset
DELETE FROM w1;
DELETE FROM w2;
SELECT wait_for_history('w1', 2);
 wait_for_history 
------------------
 t
(1 row)

SELECT wait_for_history('w2', 2);
 wait_for_history 
------------------
 t
(1 row)

SELECT * FROM undo.apply(since => :'w_t0');
 applied | skipped | conflicts 
---------+---------+-----------
       2 |       0 |         0
(1 row)

SELECT (SELECT count(*) FROM w1) AS w1_rows, (SELECT count(*) FROM w2) AS w2_rows;
 w1_rows | w2_rows 
---------+---------
       1 |       1
(1 row)

SELECT * FROM undo.apply(since => now() + interval '1 hour');
 applied | skipped | conflicts 
---------+---------+-----------
       0 |       0 |         0
(1 row)

--
-- privileges: ordinary users cannot see history
--
CREATE ROLE regress_pg_undo_nosuper;
SET SESSION AUTHORIZATION regress_pg_undo_nosuper;
SELECT count(*) FROM undo.history;					-- denied
ERROR:  permission denied for schema undo
LINE 1: SELECT count(*) FROM undo.history;
                             ^
SELECT * FROM undo.preview(last => '1 minute');		-- denied
ERROR:  permission denied for schema undo
LINE 1: SELECT * FROM undo.preview(last => '1 minute');
                      ^
RESET SESSION AUTHORIZATION;
DROP ROLE regress_pg_undo_nosuper;
--
-- recycle bin corners: quoted names, non-public schemas, FK-referenced
-- tables (which the bin diverts even though plain DROP RESTRICT would
-- refuse: nothing is lost, the dependency follows the table)
--
CREATE TABLE "Drop Me" (id int PRIMARY KEY);
DROP TABLE "Drop Me";
NOTICE:  pg_undo: moved table "public.Drop Me" to the recycle bin
HINT:  Restore it with undo.restore_dropped('Drop Me'); DROP TABLE ... CASCADE bypasses the recycle bin.
SELECT undo.restore_dropped('Drop Me');
NOTICE:  pg_undo: restored public.Drop Me
 restore_dropped 
-----------------
 "Drop Me"
(1 row)

SELECT count(*) FROM "Drop Me";
 count 
-------
     0
(1 row)

CREATE TABLE app.victim (id int PRIMARY KEY);
DROP TABLE app.victim;
NOTICE:  pg_undo: moved table "app.victim" to the recycle bin
HINT:  Restore it with undo.restore_dropped('victim'); DROP TABLE ... CASCADE bypasses the recycle bin.
SELECT original_schema, original_name FROM undo.trash;
 original_schema | original_name 
-----------------+---------------
 app             | victim
(1 row)

SELECT undo.restore_dropped('app.victim');
NOTICE:  pg_undo: restored app.victim
 restore_dropped 
-----------------
 app.victim
(1 row)

SELECT 'app.victim'::regclass;
  regclass  
------------
 app.victim
(1 row)

CREATE TABLE fk_parent (id int PRIMARY KEY);
CREATE TABLE fk_child (pid int REFERENCES fk_parent);
DROP TABLE fk_parent;			-- binned; plain DROP would raise RESTRICT
NOTICE:  pg_undo: moved table "public.fk_parent" to the recycle bin
HINT:  Restore it with undo.restore_dropped('fk_parent'); DROP TABLE ... CASCADE bypasses the recycle bin.
SELECT conname FROM pg_constraint WHERE conrelid = 'fk_child'::regclass;
      conname      
-------------------
 fk_child_pid_fkey
(1 row)

SELECT undo.restore_dropped('fk_parent');
NOTICE:  pg_undo: restored public.fk_parent
 restore_dropped 
-----------------
 fk_parent
(1 row)

INSERT INTO fk_parent VALUES (1);
INSERT INTO fk_child VALUES (1);	-- FK still enforced after the round trip
INSERT INTO fk_child VALUES (99);	-- error
ERROR:  insert or update on table "fk_child" violates foreign key constraint "fk_child_pid_fkey"
DETAIL:  Key (pid)=(99) is not present in table "fk_parent".
--
-- cleanup
--
SELECT undo.untrack('"Weird Table"');
 untrack 
---------
 
(1 row)

SELECT undo.untrack('typ');
 untrack 
---------
 
(1 row)

SELECT undo.untrack('mc');
 untrack 
---------
 
(1 row)

SELECT undo.untrack('onetxn');
 untrack 
---------
 
(1 row)

SELECT undo.untrack('pkup');
 untrack 
---------
 
(1 row)

SELECT undo.untrack('gen');
 untrack 
---------
 
(1 row)

SELECT undo.untrack('idt');
 untrack 
---------
 
(1 row)

SELECT undo.untrack('norow');
 untrack 
---------
 
(1 row)

SELECT undo.untrack('app.orders');
 untrack 
---------
 
(1 row)

SELECT undo.untrack('w1');
 untrack 
---------
 
(1 row)

SELECT undo.untrack('w2');
 untrack 
---------
 
(1 row)

SELECT undo.purge_all();
 purge_all 
-----------
         0
(1 row)

